{
  "$schema": "https://json-schema.org/draft/2020-12/schema",
  "$id": "https://jscene3d.org/schemas/resource-1.json",
  "title": "JScene3D Resource version 1",
  "type": "object",
  "additionalProperties": false,
  "required": ["schemaVersion", "type", "typeVersion"],
  "properties": {
    "$schema": {
      "type": "string",
      "format": "uri-reference"
    },
    "schemaVersion": {
      "const": 1
    },
    "type": {
      "type": "string"
    },
    "typeVersion": {
      "type": "integer",
      "minimum": 1
    },
    "properties": {
      "type": "object"
    }
  }
}
