{
  "schemaVersion": 1,
  "type": "io.github.glynch.jscene3d/triangle-mesh-shape-3d",
  "typeVersion": 1,
  "properties": {
    "positions": [
      -1, -1, -1,
      1, -1, -1,
      1, 1, -1,
      -1, 1, -1,
      -1, -1, 1,
      1, -1, 1,
      1, 1, 1,
      -1, 1, 1
    ],
    "indices": [
      0, 2, 1, 0, 3, 2,
      4, 5, 6, 4, 6, 7,
      0, 1, 5, 0, 5, 4,
      3, 7, 6, 3, 6, 2,
      0, 4, 7, 0, 7, 3,
      1, 2, 6, 1, 6, 5
    ]
  }
}
